{
  "schemaVersion": "1.1.0",
  "goal": "Rich local binary thinking check",
  "createdAt": "2026-02-20T00:00:00.000Z",
  "steps": [
    {
      "id": "step-01",
      "title": "Reasoning-heavy check",
      "description": "Read scripts/test-thinking.ts and src/providers/google.ts, explain if thinking events are emitted from both stream output and watcher path, then propose one concise validation command.",
      "successCriteria": "true",
      "status": "done",
      "attempts": 0,
      "maxAttempts": 1,
      "type": "test",
      "files": [],
      "riskLevel": "low",
      "owner": "agent",
      "postChecks": [],
      "rollbackHint": "none"
    }
  ],
  "metadata": {
    "provider": "google",
    "model": "gemini-3.0-flash-preview",
    "totalIterations": 1,
    "completedIterations": 1
  }
}
