{
  "schemaVersion": "1.1.0",
  "goal": "Manual full-loop e2e flash 3.0 postpatch",
  "createdAt": "2026-02-20T00:00:00.000Z",
  "steps": [
    {
      "id": "step-01",
      "title": "E2E thinking check postpatch",
      "description": "Send one prompt and complete successfully",
      "successCriteria": "true",
      "status": "done",
      "attempts": 0,
      "maxAttempts": 1,
      "type": "test",
      "files": [],
      "riskLevel": "low",
      "owner": "agent",
      "postChecks": [],
      "rollbackHint": "none"
    }
  ],
  "metadata": {
    "provider": "google",
    "model": "gemini-3.0-flash-preview",
    "totalIterations": 1,
    "completedIterations": 1
  }
}
